wars,from,to,duration,notes,participation, number_participants,who,where,fatalities,url_source,memorials,links
Soviet Invasion of Hungary,1956,1956,0,,"Hungary, Soviet Union",2,"Asia, Euope",Europe,"3,171",Soviet Invasion of Hungary,[2],http://www.war-memorial.net/Soviet-Invasion-of-Hungary-3.111
Sinai War,1956,1956,0,,"Israel, Egypt, France, United Kingdom",4,"Asia, Euope",Asia,"2,142",Sinai War,[2],http://www.war-memorial.net/Sinai-War-3.112
"Kenya, Mau-Mau vs UK",1954,1956,2,,"Kenya, United Kingdom",2,"Africa, Europe",Africa,"12,955","Kenya, Mau-Mau vs UK",[3],"http://www.war-memorial.net/Kenya,-Mau-Mau-vs-UK-3.110"
Tunisian war of Independence,1953,1956,3,,"Tunisia, France",2,"Africa, Europe",Africa,"2,000",Tunisian war of Independence,,http://www.war-memorial.net/Tunisian-war-of-Independence-3.105
Moroccan War of Independence,1953,1956,3,,"Morocco, France, Spain",3,"Africa, Europe",Africa,"1,000",Moroccan War of Independence,,http://www.war-memorial.net/Moroccan-War-of-Independence-3.109
Taiwan Strait Crisis,1949,1954,5,,"Taiwan, China, United States",3,"Asia, North America",Asia,"10,025",Taiwan Strait Crisis,,http://www.war-memorial.net/Taiwan-Strait-Crisis-3.305
First Indochina War Comm. vs France,1946,1954,8,,"France, Vietnam",2,"Asia, Euope",Asia,"377,523",First Indochina War Comm. vs France,[2],http://www.war-memorial.net/First-Indochina-War-Comm.-vs-France-3.103
"Philippines, Huk rebels vs Govt",1946,1954,8,,Philippines,1,Asia,Asia,"9,695","Philippines, Huk rebels vs Govt",,"http://www.war-memorial.net/Philippines,-Huk-rebels-vs-Govt-3.99"
Korean War,1949,1953,4,,"North Korea, South Korea, China, United States, Australia",5,"Asia, North America",Asia,"995,025",Korean War,[11],http://www.war-memorial.net/Korean-War-3.101
Bolivian Revolution,1952,1952,0,,Bolivia,1,South America,South America,"1,000",Bolivian Revolution,,http://www.war-memorial.net/Bolivian-Revolution-3.98
Indian Govt vs Communist Rebels CPI,1948,1951,3,,India,1,Asia,Asia,"4,000",Indian Govt vs Communist Rebels CPI,,http://www.war-memorial.net/Indian-Govt-vs-Communist-Rebels-CPI-3.318
Soviet Union vs Baltic Partisans,1945,1951,6,,"Soviet Union, Latvia, Estonia, Lithuania",4,"Asia, Euope",Europe,"32,400",Soviet Union vs Baltic Partisans,,http://www.war-memorial.net/Soviet-Union-vs-Baltic-Partisans-(%E2%80%99%E2%80%99Forest-Brethren%E2%80%99%E2%80%99)-3.302
Indonesian Govt vs Republic of South Moluccas,1950,1950,0,,Indonesia,1,Asia,Asia,"1,000",Indonesian Govt vs Republic of South Moluccas,,http://www.war-memorial.net/Indonesian-Govt-vs-Republic-of-South-Moluccas-3.323
Third Sino-Tibetan War,1950,1950,0,,China,1,Asia,Asia,"4,000",Third Sino-Tibetan War,,http://www.war-memorial.net/Third-Sino-Tibetan-War-3.97
Arab-Israeli War,1948,1949,1,,"Israel, Jordan, Egypt, Syria, Lybia, Iraq",6,"Asia, Africa",Asia,"21,111",Arab-Israeli War,[1],http://www.war-memorial.net/Arab-Israeli-War-3.91
Cheju Rebellion in South Korea,1948,1949,1,,South Korea,1,Asia,Asia,"17,000",Cheju Rebellion in South Korea,[1],http://www.war-memorial.net/Cheju-Rebellion-in-South-Korea-3.308
Chinese Civil War,1946,1949,3,,China,1,Asia,Asia,"1,200,000",Chinese Civil War,[1],http://www.war-memorial.net/Chinese-Civil-War-3.95
Greece Civil War,1946,1949,3,,Greece,1,Europe,Europe,"154,000",Greece Civil War,,http://www.war-memorial.net/Greece-Civil-War-3.92
Costa Rican Civil War,1948,1948,0,,Costa Rica,1,South America,South America,"2,000",Costa Rican Civil War,,http://www.war-memorial.net/Costa-Rican-Civil-War-3.87
Yemeni Imamate War,1948,1948,0,,Yemen,1,Asia,Asia,"4,000",Yemeni Imamate War,,http://www.war-memorial.net/Yemeni-Imamate-War-3.89
First Kashmir War,1948,1948,0,,"India, Pakistan",2,Asia,Asia,"7,500",First Kashmir War,,http://www.war-memorial.net/First-Kashmir-War-3.94
Civil War in Mandatory Palestine,1947,1948,1,,"United Kingdom, Palestine",2,"Asia, Euope",Asia,"4,009",Civil War in Mandatory Palestine,[2],http://www.war-memorial.net/Civil-War-in-Mandatory-Palestine-3.265
Telangana Rebellion and Indo-Hyderabad War,1947,1948,1,,India,1,Asia,Asia,"4,360",Telangana Rebellion and Indo-Hyderabad War,,http://www.war-memorial.net/Telangana-Rebellion-and-Indo-Hyderabad-War-3.303
Indian Partition Communal Violence,1947,1948,1,,"India, Pakistan",2,Asia,Asia,"200,000",Indian Partition Communal Violence,,http://www.war-memorial.net/Indian-Partition-Communal-Violence-3.90
Taiwanese revolt,1947,1947,0,,"Taiwan, China",2,Asia,Asia,"1,000",Taiwanese revolt,[1],http://www.war-memorial.net/Taiwanese-revolt-3.86
Madagascar Rebellion,1947,1947,0,,"France, Madagascar",2,"Africa, Europe",Africa,"6,952",Madagascar Rebellion,[1],http://www.war-memorial.net/Madagascar-Rebellion-3.93
Paraguayan Gvt vs Rebels,1947,1947,0,,Paraguay,1,South America,South America,"4,000",Paraguayan Gvt vs Rebels,,http://www.war-memorial.net/Paraguayan-Gvt-vs--Rebels-3.85
Poland and Soviet Union vs Ukrainian Partisans,1945,1947,2,,"Soviet Union, Poland, Ukraine",3,"Asia, Euope",Asia,"59,700",Poland and Soviet Union vs Ukrainian Partisans,,http://www.war-memorial.net/Poland-and-Soviet-Union-vs-Ukrainian-Partisans-3.301
Indonesian Independence,1945,1946,1,,"Indonesia, Netherlands, United Kingdom",3,"Asia, Euope",Asia,"5,400",Indonesian Independence,,http://www.war-memorial.net/Indonesian-Independence-3.84
World War II,1939,1945,6,"Si consultas la misma visualización publicada en The Infographic History of the World, ten en cuenta que los datos de origen han sido actualizados."," Australia, United Kingdom, United States, France, Italy, Germany, Denmark, Netherlands, Soviet Union, Japan, Norway, Finland, Spain, Poland, Austria, Spain, Greece, China, Canada, New Zealand, India, South Africa, Belgium, Czech Republic, Ethiopia, Mexico, Hungary, Romania, Bulgaria, Finland, Thailand, Iraq, Costa Rica, Yugoslavia",34,"Asia, Europe, North America, South America, Africa","Asia, Europe, North America, South America, Africa","50,000,000",World War II,[36],http://www.war-memorial.net/World-War-II--3.83
Franco-Thai War,1940,1941,1,,"Thailand, France, United Kingdom",3,"Europe, Asia",Asia,"1,400",Franco-Thai War,[1],http://www.war-memorial.net/Franco-Thai-War-3.82
Third Sino-Japanese War,1937,1941,4,,"Japan, China",2,Asia,Asia,"1,000,000",Third Sino-Japanese War,[6],http://www.war-memorial.net/Third-Sino-Japanese-War-3.81
The Winter War in Finland,1939,1940,1,,"Finland, Soviet Union",2,"Europe, Asia",Europe,"151,798",The Winter War in Finland,[1],http://www.war-memorial.net/The-Winter-War-in-Finland-3.80
The battle of Khalkhin Gol,1939,1939,0,,"Japan, Soviet Union",2,"Europe, Asia",Asia,"28,000",The battle of Khalkhin Gol,,http://www.war-memorial.net/The-battle-of-Khalkhin-Gol-3.79
Spanish Civil War,1936,1939,3,Participant list was updated. ,"Spain, Germany, Italy, Portugal, Soviet Union, Mexico",4,"Europe, North America","Europe, Africa","466,300",Spanish Civil War,[1],http://www.war-memorial.net/Spanish-Civil-War--3.78
Arab revolt in Mandatory Palestine,1936,1939,3,Palestine was added to participant list.,"United Kingdom, Palestine",2,"Europe, Asia",Asia,"2,576",Arab revolt in Mandatory Palestine,,http://www.war-memorial.net/-Arab-revolt-in-Mandatory-Palestine-3.299
Second British-Waziristan,1936,1939,3,Pakistan and India were added to participants list.,"United Kingdom, Pakistan, India",3,"Europe, Asia",Asia,"10,200",Second British-Waziristan,,http://www.war-memorial.net/Second-British-Waziristan-3.300
Changkufeng Incident,1938,1938,0,"Although Russia is a transcontinental country which straddles Euroasia, this conflict took place in Asia.","Japan, Soviet Union, China",3,"Europe, Asia",Asia,"1,726",Changkufeng Incident,,http://www.war-memorial.net/Changkufeng-Incident-3.75
Italo-Ethiopian War,1935,1936,1,,"Italy, Ethiopia",2,"Europe, Africa",Africa,"20,000",Italo-Ethiopian War,,http://www.war-memorial.net/Italo-Ethiopian-War-3.73
Chaco War,1932,1935,3,,"Paraguay, Bolivia",2,Asia,Asia,"92,661",Chaco War,,http://www.war-memorial.net/Chaco-War-3.72
Communists vs Koumintang,1930,1935,5,,China,1,Asia,Asia,"500,000",Communists vs Koumintang,,http://www.war-memorial.net/Communists-vs-Koumintang-3.71
Saudi-Yemeni War,1934,1934,0,,"Saudi Arabia, Yemen",2,Asia,Asia,"2,100",Saudi-Yemeni War,,http://www.war-memorial.net/Saudi-Yemeni-War-3.298
Spanish Socialists vs Govt,1934,1934,0,,Spain,1,Europe,Europe,"1,335",Spanish Socialists vs Govt,,http://www.war-memorial.net/Spanish-Socialists-vs-Govt-3.69
Xinjiang Muslim Revolt,1931,1934,3,"Although Russia is a transcontinental country which straddles Euroasia, this conflict took place in Asia.","Soviet Union, China",2,Asia,Asia,"21,000",Xinjiang Muslim Revolt,,http://www.war-memorial.net/Xinjiang-Muslim-Revolt-3.296
Manchurian War,1931,1933,2,,"Japan, China",2,Asia,Asia,"60,000",Manchurian War,[2],http://www.war-memorial.net/Manchurian-War-3.67
La Matanza ,1932,1932,0,,El Salvador,1,North America,North America,"2,600","El Salvador, La Matanza",,"http://www.war-memorial.net/El-Salvador,-La-Matanza-3.65"
Brazilian Revolt,1932,1932,0,,Brazil,1,South America,South America,"1,000",Brazilian Revolt,,http://www.war-memorial.net/Brazilian-Revolt-3.66
Aprista Revolt in Peru,1932,1932,0,,Peru,1,South America,South America,"1,100",Aprista Revolt in Peru,,http://www.war-memorial.net/Aprista-Revolt-in-Peru-3.297
Saya San Rebellion,1930,1932,2,,"United Kingdom, Myanmar",2,"Europe, Asia",Asia,"1,140",Saya San Rebellion,,http://www.war-memorial.net/Saya-San-Rebellion-3.289
Senussi Orden vs Italy,1920,1932,12,,"Italy, Lybia",2,"Europe, Africa",Africa,"40,000",Senussi Orden vs Italy,,http://www.war-memorial.net/Senussi-Orden--vs-Italy-3.64
The Yen Bai Uprising,1930,1931,1,,"Vietnam, France",2,"Europe, Asia",Asia,"1,000",The Y�n B�i Uprising,,http://www.war-memorial.net/The-Y%C3%AAn-B%C3%A1i-Uprising-3.63
Ikhwan Revolt,1929,1930,1,,Saudi Arabia,1,Asia,Asia,"5,500",Ikhwan Revolt,,http://www.war-memorial.net/Ikhwan-Revolt-3.295
Kuomintang vs Warlords,1929,1930,1,,China,1,Asia,Asia,"75,000",Kuomintang vs warlords,,http://www.war-memorial.net/Kuomintang-vs-warlords-3.61
Escobar Rebellion,1929,1929,0,,Mexico,1,North America,North America,"2,000",Escobar Rebellion,,http://www.war-memorial.net/Escobar-Rebellion-3.294
Sino-Soviet war,1929,1929,0,,"Soviet Union, China",2,"Europe, Asia","Europe, Asia","3,200",Sino-Soviet war,,http://www.war-memorial.net/Sino-Soviet-war-3.59
Second Afghan Anti-Reform War,1928,1929,1,,Afghanistan,1,Asia,Asia,"15,000",Second Afghan Anti-Reform War,,http://www.war-memorial.net/Second-Afghan-Anti-Reform-War-3.58
The Cristero War,1926,1929,3,,Mexico,1,North America,North America,"10,000",The Cristero War,,http://www.war-memorial.net/The-Cristero-War-3.60
Kuomintang vs Gansu Rebels,1928,1928,0,,China,1,Asia,Asia,"200,000",Kuomintang vs Gansu Rebels,,http://www.war-memorial.net/Kuomintang-vs-Gansu-Rebels-3.57
Northern Expedition,1926,1928,2,,China,1,Asia,Asia,"126,500",Northern Expedition,,http://www.war-memorial.net/Northern-Expedition-3.56
Druze revolt,1925,1927,2,,"France, Syria",2,"Europe, Asia",Asia,"6,000",Druze revolt,,http://www.war-memorial.net/Druze-revolt-3.54
Third Chinese Warlord War,1925,1926,1,,China,1,Asia,Asia,"1,000",Third Chinese Warlord War,,http://www.war-memorial.net/Third-Chinese-Warlord-War-3.311
Third Rif War,1920,1926,6,Morocco has been added to the list of participants.,"Spain, France, Morocco",3,"Europe, Africa",Africa,"70,000",Third Rif War,,http://www.war-memorial.net/Third-Rif-War-3.53
Afghan rebels vs govt,1924,1925,1,,Afghanistan,1,Asia,Asia,"2,000",Afghan rebels vs govt,,http://www.war-memorial.net/Afghan-rebels-vs-govt-3.52
Nejd-Hejaz Wars,1919,1925,6,,Saudi Arabia,1,Asia,Asia,"4,000",Nejd-Hejaz Wars,,http://www.war-memorial.net/Nejd-Hejaz-Wars-3.283
Honduras Coup,1924,1924,0,,Honduras,1,North America,North America,"1,000",Honduras Coup,,http://www.war-memorial.net/Honduras-Coup-3.51
Soviet-Turkestan War,1921,1923,2,,"Russia, Turkestan",2,"Europe, Asia	","Europe, Asia","3,500",Soviet-Turkestan War,,http://www.war-memorial.net/Soviet-Turkestan-War-3.293
Second Chinese Warlord War,1922,1922,0,,China,1,Asia,Asia,"20,000",Second Chinese Warlord War,,http://www.war-memorial.net/Second-Chinese-Warlord-War-3.310
Moplah Riots in Kerala,1921,1922,1,,"India, United Kingdom",2,"Europe, Asia	",Asia,"2,450",Moplah Riots in Kerala,,http://www.war-memorial.net/Moplah-Riots-in-Kerala-3.48
Ireland freestaters vs Irregulars,1921,1922,1,,Ireland,1,Europe,Europe,"4,000",Ireland freestaters vs Irregulars,,http://www.war-memorial.net/Ireland-freestaters-vs-Irregulars--3.50
Blackshirts vs Leftists,1920,1922,2,,Italy,1,Europe,Europe,"3,300",Blackshirts vs Leftists,,http://www.war-memorial.net/Blackshirts-vs-Leftists-3.291
Second Greco Turkish War,1919,1922,3,,"Greece, Turkey",2,"Europe, Asia	","Europe, Asia","50,000",Second Greco Turkish War,,http://www.war-memorial.net/Second-Greco-Turkish-War-3.49
Russian Revolution and Civil War,1917,1922,5,,"Russia, United Kingdom, France, Japan, United States, Soviet Union",6,"Europe, Asia, North America	","Europe, Asia","802,225",Russian Revolution and Civil War,[1],http://www.war-memorial.net/Russian-Revolution-and-Civil-War-3.47
Kronstadt Rebellion,1921,1921,0,"This conflict is marked as Europe and Asia, because the Soviet Union was a transcontinental country which straddles Euroasia.",Soviet Union,1,"Europe, Asia	","Europe, Asia","2,600",Kronstadt Rebellion,,http://www.war-memorial.net/Kronstadt-Rebellion-3.292
Conquest of Mongolia,1920,1921,1,"Although the Soviet Union was a transcontinental country which straddles Euroasia, this conflict took place in Asia.","China, Soviet Union",2,"Europe, Asia	",Asia,"4,000",Conquest of Mongolia,,http://www.war-memorial.net/Conquest-of-Mongolia-3.287
Green Rebellion,1920,1921,1,"This conflict is marked as Europe and Asia, because the Soviet Union was a transcontinental country which straddles Euroasia.",Soviet Union,1,"Europe, Asia	","Europe, Asia","6,700",Green Rebellion,,http://www.war-memorial.net/Green-Rebellion-3.290
Iraq vs UK,1920,1921,1,,"United Kingdom, Iraq",2,"Europe, Asia	","Europe, Asia","9,540",Iraq vs UK,,http://www.war-memorial.net/Iraq-vs-UK-3.46
Turkish War of Independence,1919,1921,2,,"France, Turkey",2,"Europe, Asia	","Europe, Asia","40,000",Turkish War of Independence,,http://www.war-memorial.net/Turkish-War-of-Independence-3.45
First Chinese Warlord War,1920,1920,0,,China,1,Asia,Asia,"35,000",First Chinese Warlord War,,http://www.war-memorial.net/First-Chinese-Warlord-War-3.309
Franco-Syrian war,1920,1920,0,,"France, Syria",2,"Europe, Asia",Asia,"3,500",Franco-Syrian war,[1],http://www.war-memorial.net/Franco-Syrian-war--3.42
Lithuanian-Polish War,1920,1920,0,,"Poland, Lithuania",2,Europe,Europe,"1,000",Lithuanian-Polish War,,http://www.war-memorial.net/Lithuanian-Polish-War-3.285
Hungary Civil War,1919,1920,1,"United States, Romania, Yugoslavia and Czechoslovakia were added to the list of participants.","Hungary, United States, Romania, Yugoslavia, Czechoslovakia",5,"Europe, North America",Europe,"1,500",Hungary Civil War,,http://www.war-memorial.net/Hungary-Civil-War-3.40
Polish-Soviet War,1919,1920,1,,"Soviet Union, Poland",2,"Europe, Asia	",Europe,"100,000",Polish-Soviet War,,http://www.war-memorial.net/Polish-Soviet-War-3.41
First British-Waziristan War,1919,1920,1,India was added to the list of participants.,"United Kingdom, Pakistan, India",3,"Europe, Asia",Asia,"2,000",First British-Waziristan War,,http://www.war-memorial.net/First-British-Waziristan-War-3.286
Estonian Liberation War,1918,1920,2,,"Soviet Union, Finland, Estonia",3,"Europe, Asia	",Europe,"11,750",Estonian Liberation War,[2],http://www.war-memorial.net/Estonian-Liberation-War-3.279
Latvian Liberation,1918,1920,2,,"Soviet Union, Germany, Latvia, Estonia",4,"Europe, Asia	",Europe,"13,246",Latvian Liberation,,http://www.war-memorial.net/Latvian-Liberation-3.280
Caco Revolt,1918,1920,2,,"United States, Haiti",2,North America,North America,"2,102",Caco Revolt,,http://www.war-memorial.net/Caco-Revolt-3.282
Mexican Revolution,1910,1920,10,,Mexico,1,North America,North America,"125,000",Mexican Revolution,[1],http://www.war-memorial.net/Mexican-Revolution--3.39
"The Dervish State vs Ethiopia, Britain and Italy",1899,1920,21,,"United Kingdom, Somalia, Ethiopia, Dervish State, Italy",5,"Europe, Africa",Africa,"6,000","The Dervish State vs Ethiopia, Britain and Italy",,"http://www.war-memorial.net/The-Dervish-State-vs-Ethiopia,-Britain-and-Italy-3.9"
Sparticist Rising,1919,1919,0,,Germany,1,Europe,Europe,"2,170",Sparticist Rising,,http://www.war-memorial.net/Sparticist-Rising-3.284
Hungarian Romanian War,1919,1919,0,,"Romania, Hungary",2,Europe,Europe,"11,000",Hungarian_Romanian War of 1919,,http://www.war-memorial.net/Hungarian%E2%80%93Romanian-War-of-1919-3.36
Third Anglo-Afghan War,1919,1919,0,,"Afghanistan, United Kingdom",2,"Europe, Asia",Asia,"2,136",Third Anglo-Afghan War,,http://www.war-memorial.net/Third-Anglo-Afghan-War-3.37
Finnish Civil War,1918,1918,0,Germany and Russia were added to the list of participants.,"Finland, Germany, Russia",3,"Europe, Asia",Europe,"15,150",Finnish Civil War,[1],http://www.war-memorial.net/Finnish-Civil-War-3.35
Second Sino-Tibetan,1918,1918,0,,China,1,Asia,Asia,"1,500",Second Sino-Tibetan,,http://www.war-memorial.net/Second-Sino-Tibetan-3.281
Southern China Revolt,1915,1918,3,,China,1,Asia,Asia,"1,000",Southern China Revolt,,http://www.war-memorial.net/Southern-China-Revolt-3.29
World War I,1914,1918,4,"Si consultas la misma visualización publicada en The Infographic History of the World, ten en cuenta que los datos de origen han sido actualizados."," Australia, Germany, France, United Kingdom, Italy, Russia, Greece, Hungary, Turkey, United States, Austria, Andorra, Belgium, Brazil, China, Cuba, Costa Rica, Guatemala, Haiti, Honduras, Japan, Liberia, Montenegro, Nepal, Nicaragua, Panama, Portugal, Romania, Russia, San Marino, Serbia, Thailand, Canada, Australia, Malta, New Zealand, South Africa, Philippines, Puerto Rico, Azerbaijan, Bulgaria, Austria-Hungary, Dervish State, Jabal Shammar, Ottoman Empire",45,"Asia, Europe, North America, South America, Africa","Asia, Europe, North America, South America, Africa","10,670,868",World War I,[12],http://www.war-memorial.net/World-War-I-3.32
Russia-Turkestan,1916,1917,1,,"Russia, Turkestan",2,"Europe, Asia	",Asia,"1,350",Russia-Turkestan,,http://www.war-memorial.net/Russia-Turkestan-3.278
Chinese Govt vs Bai Lang Rebels,1914,1914,0,,China,1,Asia,Asia,"5,000",Chinese Govt vs Bai Lang (White Wolf) Rebels,,http://www.war-memorial.net/Chinese-Govt-vs-Bai-Lang-(White-Wolf)-Rebels-3.28
2nd Balkan War,1913,1913,0,,"Yugoslavia, Greece, Bulgaria, Ottoman Empire, Romania",5,"Europe","Europe","60,500",2nd Balkan War,,http://www.war-memorial.net/2nd-Balkan-War--3.26
Kuomintang vs Chinese Army,1913,1913,0,,China,1,Asia,Asia,"5,000",Kuomintang vs Chinese Army,,http://www.war-memorial.net/Kuomintang-vs-Chinese-Army--3.27
Moro Rebellion,1913,1913,0,"Where the conflict took place: Philippines, Asia.","United States, Philippines",2,"North America, Asia",Asia,"15,050",Moro Rebellion,,http://www.war-memorial.net/Moro-Rebellion-3.277
1st Balkan War,1912,1913,1,,"Serbia, Montenegro, Greece, Bulgaria, Macedonia, Ottoman Empire",6,"Europe","Europe","82,000",1st Balkan War,[1],http://www.war-memorial.net/1st-Balkan-War-3.25
Paraguay Coups,1911,1912,1,,Paraguay,1,South America,South America,"5,000",Paraguay Coups,,http://www.war-memorial.net/Paraguay-Coups-3.22
Italo-Turkish War,1911,1912,1,"Ottoman Empire was one of the most powerful states in the world during the 15th and 16th centuries. It spanned more than 600 years and came to an end only in 1922, when it was replaced by the Turkish Republic and various successor states in southeastern Europe and the Middle East. ","Italy, Ottoman Empire",2,"Europe, Asia, Africa",Africa,"20,000",Italo-Turkish War,,http://www.war-memorial.net/Italo-Turkish-War-3.23
First Sino-Tibetan War,1911,1912,1,,China,1,Asia,Asia,"2,000",First Sino-Tibetan War,,http://www.war-memorial.net/First-Sino-Tibetan-War-3.24
Cuba vs Partido Independiente de Color,1911,1911,0,,"Cuba, United States",2,"North America, South America",North America,"1,050",Cuba vs Partido Independiente de Color,,http://www.war-memorial.net/Cuba-vs-Partido-Independiente-de-Color-3.276
Chinese Revolution,1911,1911,0,,China,1,Asia,Asia,"1,000",Chinese Revolution,[2],http://www.war-memorial.net/Chinese-Revolution--3.21
Asir-Yemen Revolt,1910,1911,1,"Ottoman Empire was one of the most powerful states in the world during the 15th and 16th centuries. It spanned more than 600 years and came to an end only in 1922, when it was replaced by the Turkish Republic and various successor states in southeastern Europe and the Middle East. ","Yemen, Ottoman Empire",2,Asia,Asia,"9,000",Asir-Yemen Revolt,,http://www.war-memorial.net/Asir-Yemen-Revolt-3.275
French Conquest of Wadai Sultanate,1909,1911,2,,"France, Chad",2,"Europe, Africa",Africa,"12,000",French Conquest of Wadai Sultanate,,http://www.war-memorial.net/French-Conquest-of-Wadai-Sultanate-3.274
The second Rif War,1909,1910,1,,"Morocco, Spain",2,"Africa, Europe",Africa,"10,000",The second Rif War,,http://www.war-memorial.net/The-second-Rif-War-3.19
Portugese war against Dembos,1907,1910,3,,"Angola, Portugal",2,"Africa, Europe",Africa,"5,100",Portugese war against Dembos,,http://www.war-memorial.net/Portugese-war-against-Dembos-3.271
Ma al-Aynayn's Anti-Colonial Insurgency,1907,1910,3,,"Morocco, France",2,"Africa, Europe",Africa,"3,150",Ma al-�Aynayn�s Anti-Colonial Insurgency,,http://www.war-memorial.net/Ma-al-%E2%80%99Aynayn%E2%80%99s-Anti-Colonial-Insurgency--3.272
Korean guerilla war against Japanese occupation,1907,1910,3,,"South Korea, Japan",2,Asia,Asia,"17,736",Korean guerilla war against Japanese occupation,,http://www.war-memorial.net/Korean-guerilla-war-against-Japanese-occupation-3.273
Iranian Constitution War,1908,1909,1,"The location is marked as Europe and Asia, because Russia is a transcontinental country which straddles Euroasia.","Iran, Russia",2,"Europe, Asia	","Europe, Asia","1,100",Iranian Constitution War,,http://www.war-memorial.net/Iranian-Constitution-War-3.18
Morocco unrest,1907,1908,1,,"Morocco, France",2,"Europe, Africa",Africa,"1,400",Morocco unrest,,http://www.war-memorial.net/Morocco-unrest-3.17
Romanian Peasant Revolt,1907,1907,0,The western part of Moldavia is now part of Romania.,Romania,1,Europe,Europe,"2,000",Romanian Peasant Revolt,,http://www.war-memorial.net/Romanian-Peasant-Revolt-3.16
Fourth Central American war,1907,1907,0,,"Honduras, El Salvador, Nicaragua",3,North America,North America,"1,000",Fourth Central American war,,http://www.war-memorial.net/4th-Central-American-war--3.15
Dutch-Achinese War,1904,1907,3,,"Netherlands, Sumatra",2,"Europe, Africa",Africa,"24,200",Dutch-Achinese War,,http://www.war-memorial.net/Dutch-Achinese-War-3.269
Sokoto and UK vs Mahdist Revolt,1906,1906,0,,"Nigeria, United Kingdom",2,"Africa, Europe",Africa,"2,080",Sokoto and UK vs Mahdist Revolt,,http://www.war-memorial.net/Sokoto-and-UK-vs-Mahdist-Revolt-3.270
Zulu Rebellion,1906,1906,0,,"Natal, United Kingdom",2,"Africa, Europe",Africa,"2,356",Zulu Rebellion,,http://www.war-memorial.net/Zulu-Rebellion-3.13
Third Central American war,1906,1906,0,,"Honduras, El Salvador, Guatemala",3,North America,North America,"1,000",Third Central American war,,http://www.war-memorial.net/Third-Central-American-war--3.14
Russian Revolution,1905,1906,1,"The location is marked as both Europe and Asia, because Russia is a transcontinental country which straddles Euroasia.",Russia,1,"Europe, Asia","Europe, Asia","1,500",Russian Revolution 1905,,http://www.war-memorial.net/Russian-Revolution-1905--3.7
Maji Maji revolt,1905,1906,1,,"Germany, Tanzania",2,"Africa, Europe",Africa,"8,840",Maji Maji revolt,,http://www.war-memorial.net/Maji-Maji-revolt-3.12
Russo-Japanese war,1904,1905,1,,"Russia, Japan",2,Asia,Asia,"151,831",Russo-Japanese war,[1],http://www.war-memorial.net/Russo-Japanese-war-3.10
Southwest African Revolt,1904,1905,1,Namibia was added to the list of participants.,"Germany, Namibia",2,"Africa, Europe",Africa,"12,800",Southwest African Revolt,[1],http://www.war-memorial.net/Southwest-African-Revolt-3.11
Uruguay Civil War,1904,1904,0,,Uruguay,1,South America,South America,"1,000",Uruguay Civil War,,http://www.war-memorial.net/Uruguay-Civil-War-3.8
Second Yemen Rebellion,1904,1904,0,"Ottoman Empire was one of the most powerful states in the world during the 15th and 16th centuries. It spanned more than 600 years and came to an end only in 1922, when it was replaced by the Turkish Republic and various successor states in southeastern Europe and the Middle East. ","Yemen, Ottoman Empire",2,Asia,Asia,"30,000",Second Yemen Rebellion,,http://www.war-memorial.net/Second-Yemen-Rebellion-3.266
Uprisings in Colonial Angola,1902,1904,2,,"Angola, Portugal",2,"Europe, Africa",Africa,"2,000",Uprisings in Colonial Angola,,http://www.war-memorial.net/Uprisings-in-Colonial-Angola-3.268
Ilinden Uprising,1903,1903,0,"Ottoman Empire was one of the most powerful states in the world during the 15th and 16th centuries. It spanned more than 600 years and came to an end only in 1922, when it was replaced by the Turkish Republic and various successor states in southeastern Europe and the Middle East. ",Ottoman Empire,1,"Europe, Asia",Asia,"6,330",Ilinden Uprising,,http://www.war-memorial.net/Ilinden-Uprising-3.6
The War of a Thousand Days,1899,1903,4,,Colombia,1,South America,South America,"100,000",The War of a Thousand Days,,http://www.war-memorial.net/The-War-of-a-Thousand-Days---3.5
Philippine insurrection,1899,1902,3,,"Philippines, United States",2,"America, Asia",Asia,"20,500",Philippine insurrection,,http://www.war-memorial.net/Philippine-insurrection--3.3
